id,include,topic,type,title,description,link,
121,YY,Publishing,KB-i,European Commission Guidelines for Inclusive Communication,"The purpose of the guidelines is to set common standards for inclusive communication and to provide practical examples and advice concerning both internal and external communication. These guidelines build on the existing Commission Style Guide and encompass various aspects of inclusive communication, from written to visual communications and IT requirements for greater accessibility. They include general principles; dedicated chapters on gender, LGBTIQ, racial and ethnic background, cultures, lifestyles or beliefs, dissabilities, age; and a quick checklist for preparing inclusive communictation material.",https://myintracomm.ec.europa.eu/sg/task-force-equality/Documents/guidelines-for-Inclusive-communication.pdf,
122,Y,Data management,KB-i,Operational Corporate  Guidance on Data Quality,"A set of recommendations and practical tools which can be used to assess, record, and improve data quality across the Commission services.",,
123,YY,Metadata,KB-x,EU Vocabularies catalogue,Browse and access Eurovoc and other EU reference data and online tools to help you describe data consistently. ,https://op.europa.eu/en/web/eu-vocabularies,
124,M,Open data,KB-x,handbook.opendata.swiss,"Guidelines for the Open Government Data strategy 2019-2023 of the Swiss federal govenrment, including a decision tree on whether data can be released as open data. Available in FR and DE.",https://handbook.opendata.swiss/fr/content/glossar/bibliothek/ogd-richtlinien.html,
125,YY,Writing,KB-i,Writer's toolbox,"A set of resources gathered by the DGT's editing service, a team of native English speakers who edit, train and advise on clear writing across the Commission.",https://myintracomm.ec.europa.eu/work/EN/writing-help-advice,
126,YY,Writing,KB-i,European Commission Clear Writing Guide,"A booklet offering some principles, not rules, that will help you avoid common pitfalls and write clearly in English.",https://myintracomm-collab.ec.europa.eu/networks/CWC/SiteAssets/SitePages/Clear-Writing-Guide-Booklet/Clear-Writing-Guide-Booklet_A5_Web.pdf,